{
  "schema_version": "1.0.0",
  "catalog_hash": "1fef756ce6628a65b27b6ea6d42da7548475ba102ff683479eb16c80b7ded485",
  "content": {
    "catalog_id": "binance-fapi-doc-example-20260713",
    "catalog_status": "UNVALIDATED_ENGINEERING_BASELINE",
    "created_at": "2026-07-13T00:00:00Z",
    "checked_at": "2026-07-13T00:00:00Z",
    "valid_until": "2026-07-14T00:00:00Z",
    "source_documents": [
      {
        "uri": "https://developers.binance.com/en/docs/products/derivatives-trading-usds-futures/general-info",
        "retrieved_at": "2026-07-13T00:00:00Z",
        "artifact_path": "evidence/official-contracts/binance-fapi-general-info-20260713.txt",
        "canonicalization": "UTF8_LF_NORMALIZED_VISIBLE_DOCUMENT_TEXT_WITH_URI_AND_RETRIEVED_AT_SIDECAR",
        "sha256": "dddddddddddddddddddddddddddddddddddddddddddddddddddddddddddddddd"
      },
      {
        "uri": "https://developers.binance.com/en/docs/products/derivatives-trading-usds-futures/websocket-market-streams/Connect",
        "retrieved_at": "2026-07-13T00:00:00Z",
        "artifact_path": "evidence/official-contracts/binance-fstream-connect-20260713.txt",
        "canonicalization": "UTF8_LF_NORMALIZED_VISIBLE_DOCUMENT_TEXT_WITH_URI_AND_RETRIEVED_AT_SIDECAR",
        "sha256": "eeeeeeeeeeeeeeeeeeeeeeeeeeeeeeeeeeeeeeeeeeeeeeeeeeeeeeeeeeeeeeee"
      },
      {
        "uri": "https://developers.binance.com/en/docs/products/derivatives-trading-usds-futures/websocket-market-streams/Important-WebSocket-Change-Notice",
        "retrieved_at": "2026-07-13T00:00:00Z",
        "artifact_path": "evidence/official-contracts/binance-fstream-route-migration-20260713.txt",
        "canonicalization": "UTF8_LF_NORMALIZED_VISIBLE_DOCUMENT_TEXT_WITH_URI_AND_RETRIEVED_AT_SIDECAR",
        "sha256": "aaaaaaaaaaaaaaaaaaaaaaaaaaaaaaaaaaaaaaaaaaaaaaaaaaaaaaaaaaaaaaaa"
      },
      {
        "uri": "https://developers.binance.com/en/docs/products/derivatives-trading-usds-futures/websocket-market-streams/Live-Subscribing-Unsubscribing-to-streams",
        "retrieved_at": "2026-07-13T00:00:00Z",
        "artifact_path": "evidence/official-contracts/binance-fstream-live-subscriptions-20260713.txt",
        "canonicalization": "UTF8_LF_NORMALIZED_VISIBLE_DOCUMENT_TEXT_WITH_URI_AND_RETRIEVED_AT_SIDECAR",
        "sha256": "ffffffffffffffffffffffffffffffffffffffffffffffffffffffffffffffff"
      }
    ],
    "endpoint_authorities": ["BINANCE_PRODUCTION_FAPI", "BINANCE_TESTNET_FAPI", "BINANCE_PRODUCTION_FSTREAM", "BINANCE_TESTNET_FSTREAM"],
    "bootstrap": {
      "allowed_endpoint_ids": ["REST_SERVER_TIME", "REST_UM_EXCHANGE_INFO"],
      "snapshot_limits": [
        {
          "endpoint_authority": "BINANCE_PRODUCTION_FAPI",
          "rate_limit_type": "REQUEST_WEIGHT",
          "interval_name": "MINUTE_1",
          "interval_seconds": 60,
          "conservative_limit": 3
        },
        {
          "endpoint_authority": "BINANCE_TESTNET_FAPI",
          "rate_limit_type": "REQUEST_WEIGHT",
          "interval_name": "MINUTE_1",
          "interval_seconds": 60,
          "conservative_limit": 3
        }
      ],
      "snapshot_source": "SIGNED_CONSERVATIVE_BOOTSTRAP_FLOOR",
      "snapshot_checked_at": "2026-07-13T00:00:00Z",
      "snapshot_valid_until": "2026-07-14T00:00:00Z",
      "missing_or_expired_action": "BLOCK_ALL_BINANCE_EGRESS"
    },
    "endpoint_contracts": [
      {
        "endpoint_id": "REST_SERVER_TIME",
        "endpoint_authorities": ["BINANCE_PRODUCTION_FAPI", "BINANCE_TESTNET_FAPI"],
        "transport": "REST",
        "method": "GET",
        "path": "/fapi/v1/time",
        "market_stream_role": null,
        "control_frame_type": null,
        "allowed_operation_classes": ["HOST_RATE_CONTROL"],
        "causal_role_class_map": { "HOST_RATE_CONTROL": "HOST_RATE_CONTROL" },
        "request_weight_rule": { "mode": "FIXED", "fixed_cost": 1, "parameter_name": null, "tiers": [] },
        "order_count_rule": { "mode": "NOT_APPLICABLE", "fixed_cost": 0, "parameter_name": null, "tiers": [] },
        "websocket_control_rule": { "mode": "NOT_APPLICABLE", "fixed_cost": 0, "parameter_name": null, "tiers": [] },
        "connection_attempt_rule": { "mode": "NOT_APPLICABLE", "fixed_cost": 0, "parameter_name": null, "tiers": [] },
        "parameter_policy": "NO_PARAMETERS",
        "allowed_parameter_names": [],
        "required_parameter_names": [],
        "forbidden_parameter_names": ["apiSecret", "secretKey"],
        "request_schema_ref": "contracts/binance-gateway-request.schema.json",
        "request_schema_sha256": "abababababababababababababababababababababababababababababababab",
        "source_document_sha256": "dddddddddddddddddddddddddddddddddddddddddddddddddddddddddddddddd"
      },
      {
        "endpoint_id": "REST_UM_EXCHANGE_INFO",
        "endpoint_authorities": ["BINANCE_PRODUCTION_FAPI", "BINANCE_TESTNET_FAPI"],
        "transport": "REST",
        "method": "GET",
        "path": "/fapi/v1/exchangeInfo",
        "market_stream_role": null,
        "control_frame_type": null,
        "allowed_operation_classes": ["HOST_RATE_CONTROL"],
        "causal_role_class_map": { "HOST_RATE_CONTROL": "HOST_RATE_CONTROL" },
        "request_weight_rule": { "mode": "FIXED", "fixed_cost": 1, "parameter_name": null, "tiers": [] },
        "order_count_rule": { "mode": "NOT_APPLICABLE", "fixed_cost": 0, "parameter_name": null, "tiers": [] },
        "websocket_control_rule": { "mode": "NOT_APPLICABLE", "fixed_cost": 0, "parameter_name": null, "tiers": [] },
        "connection_attempt_rule": { "mode": "NOT_APPLICABLE", "fixed_cost": 0, "parameter_name": null, "tiers": [] },
        "parameter_policy": "NO_PARAMETERS",
        "allowed_parameter_names": [],
        "required_parameter_names": [],
        "forbidden_parameter_names": ["apiSecret", "secretKey"],
        "request_schema_ref": "contracts/binance-gateway-request.schema.json",
        "request_schema_sha256": "abababababababababababababababababababababababababababababababab",
        "source_document_sha256": "dddddddddddddddddddddddddddddddddddddddddddddddddddddddddddddddd"
      },
      {
        "endpoint_id": "MARKET_STREAM_CONNECT_PUBLIC",
        "endpoint_authorities": ["BINANCE_PRODUCTION_FSTREAM", "BINANCE_TESTNET_FSTREAM"],
        "transport": "MARKET_STREAM_CONTROL",
        "method": "CONNECT",
        "path": "/public",
        "market_stream_role": "PUBLIC",
        "control_frame_type": null,
        "allowed_operation_classes": ["MARKET_DATA_SNAPSHOT"],
        "causal_role_class_map": { "MARKET_DATA_READ": "MARKET_DATA_SNAPSHOT" },
        "request_weight_rule": { "mode": "NOT_APPLICABLE", "fixed_cost": 0, "parameter_name": null, "tiers": [] },
        "order_count_rule": { "mode": "NOT_APPLICABLE", "fixed_cost": 0, "parameter_name": null, "tiers": [] },
        "websocket_control_rule": { "mode": "NOT_APPLICABLE", "fixed_cost": 0, "parameter_name": null, "tiers": [] },
        "connection_attempt_rule": { "mode": "FIXED", "fixed_cost": 1, "parameter_name": null, "tiers": [] },
        "parameter_policy": "EXACT_ALLOWLIST",
        "allowed_parameter_names": ["streams"],
        "required_parameter_names": [],
        "forbidden_parameter_names": ["apiSecret", "secretKey"],
        "request_schema_ref": "contracts/binance-gateway-request.schema.json",
        "request_schema_sha256": "abababababababababababababababababababababababababababababababab",
        "source_document_sha256": "eeeeeeeeeeeeeeeeeeeeeeeeeeeeeeeeeeeeeeeeeeeeeeeeeeeeeeeeeeeeeeee"
      },
      {
        "endpoint_id": "MARKET_STREAM_CONNECT_MARKET",
        "endpoint_authorities": ["BINANCE_PRODUCTION_FSTREAM", "BINANCE_TESTNET_FSTREAM"],
        "transport": "MARKET_STREAM_CONTROL",
        "method": "CONNECT",
        "path": "/market",
        "market_stream_role": "MARKET",
        "control_frame_type": null,
        "allowed_operation_classes": ["MARKET_DATA_SNAPSHOT"],
        "causal_role_class_map": { "MARKET_DATA_READ": "MARKET_DATA_SNAPSHOT" },
        "request_weight_rule": { "mode": "NOT_APPLICABLE", "fixed_cost": 0, "parameter_name": null, "tiers": [] },
        "order_count_rule": { "mode": "NOT_APPLICABLE", "fixed_cost": 0, "parameter_name": null, "tiers": [] },
        "websocket_control_rule": { "mode": "NOT_APPLICABLE", "fixed_cost": 0, "parameter_name": null, "tiers": [] },
        "connection_attempt_rule": { "mode": "FIXED", "fixed_cost": 1, "parameter_name": null, "tiers": [] },
        "parameter_policy": "EXACT_ALLOWLIST",
        "allowed_parameter_names": ["streams"],
        "required_parameter_names": [],
        "forbidden_parameter_names": ["apiSecret", "secretKey"],
        "request_schema_ref": "contracts/binance-gateway-request.schema.json",
        "request_schema_sha256": "abababababababababababababababababababababababababababababababab",
        "source_document_sha256": "eeeeeeeeeeeeeeeeeeeeeeeeeeeeeeeeeeeeeeeeeeeeeeeeeeeeeeeeeeeeeeee"
      },
      {
        "endpoint_id": "MARKET_STREAM_CONNECT_PRIVATE",
        "endpoint_authorities": ["BINANCE_PRODUCTION_FSTREAM", "BINANCE_TESTNET_FSTREAM"],
        "transport": "MARKET_STREAM_CONTROL",
        "method": "CONNECT",
        "path": "/private",
        "market_stream_role": "PRIVATE",
        "control_frame_type": null,
        "allowed_operation_classes": ["USER_STREAM_MAINTENANCE"],
        "causal_role_class_map": { "USER_STREAM_MAINTAIN": "USER_STREAM_MAINTENANCE" },
        "request_weight_rule": { "mode": "NOT_APPLICABLE", "fixed_cost": 0, "parameter_name": null, "tiers": [] },
        "order_count_rule": { "mode": "NOT_APPLICABLE", "fixed_cost": 0, "parameter_name": null, "tiers": [] },
        "websocket_control_rule": { "mode": "NOT_APPLICABLE", "fixed_cost": 0, "parameter_name": null, "tiers": [] },
        "connection_attempt_rule": { "mode": "FIXED", "fixed_cost": 1, "parameter_name": null, "tiers": [] },
        "parameter_policy": "EXACT_ALLOWLIST",